Category,Subcategory,Strength,Multiplier,en,de,ru,eo,pl,it,ua
2,2,4,1,All drugs should be legal for the adult population,Alle Drogen sollten für die erwachsene Bevölkerung legal sein,Все виды наркотиков должны быть разрешены для взрослых людей,Ĉiuj narkotikaĵoj devas esti leĝaj por ĉiuj adoltoj,Wszystkie środki odurzające powinny być legalne dla dorosłych,Tutte le droghe dovrebbero essere legali per la popolazione adulta,Усі види наркотичних речовин мають бути дозволені для дорослого населення
2,2,1,-1,It is sometimes necessary to ban some substances from the general population,Manchmal ist es notwendig bestimmte Substanzen für die Allgemeinbevölkerung zu verbieten,Иногда необходимо запрещать некоторые вещества для обычных людей,Oni iutempe devas malpermesi iujn substanciojn por ĝeneralaj homoj,Czasami konieczne jest wprowadzenie zakazu stosowania niektórych substancji dla ogółu populacji,"È necessario, a volte, vietare alcune sostanze ai cittadini",Інколи потрібно забороняти населенню доступ до деяких речовин
2,2,3,1,Prostitution should be legal,Prostitution sollte legal sein,Проституция должна быть легальной,Prostituado devas esti leĝa,Prostytucja powinna być legalna,La prostituzione dovrebbe essere legale,Проституція повиння бути легальною
2,2,3,1,Marijuana should be legal for the adult population,Marihuana sollte für die erwachsene Bevölkerung legal sein,Марихуана должна быть легальной для взрослых,Mariĥuano devas esti leĝa por adoltoj,Marihuana powinna być legalna dla dorosłych,La marijuana dovrebbe essere legale per la popolazione adulta,Марихуана має бути дозволеною для дорослих
2,2,2,1,Pornographic materials should be legal for the adult population,Pornografische Materialien sollten für die erwachsene Bevölkerung legal sein,Порнографические материалы должны быть легальными для взрослых,Pornografiaĵoj devas esti leĝaj por adoltoj,Materiały pornograficzne powinny być legalne dla dorosłych,Materiali pornografici dovrebbero essere legali per la popolazione adulta,Порнографічні матеріали мають бути легальними для дорослих
2,2,2,1,Smoking should be legal,Rauchen sollte legal sein,Курение должно быть легальным,Fumado devas esti leĝa,Palenie powinno być legalne,Fumare dovrebbe essere legale,Паління має бути легальним
2,2,1,1,The government should not officially support any religion (or lack of religion),Die Regierung sollte offiziell keine Religion unterstützen (oder,Государство не должно официально поддерживать какую-либо религию (или её отсутствие),La registaro ne subtenu ajnan religion (aŭ mankon de ĝi),Rząd nie powinien oficjalnie wspierać żadnej religii (lub braku religii),Lo stato non dovrebbe supportare ufficialmente nessuna religione (o assenza di esse),Уряд не має офіційно підтримувати яку-небудь релігію (чи її відсутність)
2,2,1,1,Freedom of religion is an important concept,Religionsfreiheit ist ein wichtiges Konzept,Свобода верисповедания — это важная концепция,Libero de religio estas grava koncepto,Ważna jest wolność wyznania,La libertà di fede è un valore importante,Свобода віросповідання - це важлива концепція
3,0,4,1,Constant war is needed to make an economy thrive,Konstanter Krieg ist nötig damit die Wirtschaft gedeiht,"Постоянные войны необходимы, чтобы держать экономику в тонусе",Konstantaj militoj estas bezonataj por prosperigi la ekonomion,"Potrzebna jest ciągła wojna, aby gospodarka mogła się rozwijać",È necessario essere costantemente in guerra per far crescere l'economia,Постійна війна необхідна для процвітання економіки
3,0,4,1,My nation should conquer other nations,Mein Land sollte andere Länder erobern,Моя нация должна завоёвывать другие нации,Mia nacio devas konkeri aliajn naciojn,Mój naród powinien podbić inne narody,La mia nazione dovrebbe conquistare altre nazioni,Моя нація має завойовувати інші нації
3,0,3,1,There is nothing wrong with taking the resources of weaker nations,"Es ist nichts falsch daran, die Rohstoffe schwächerer Länder zu nehmen",Нет ничего плохого в изымании ресурсов у более слабых стран,Estas nenio malbona en prenado de resursoj de malpli fortaj nacioj,Nie ma nic złego w przyjmowaniu zasobów słabszych narodów,Non c'è niente di male nel prendere le risorse di altre nazioni più deboli,"Немає нічого поганого у тому, щоби забирати ресурси у слабкіших народів
3,0,3,1,Leaders who oppose our interests should be toppled,"Führer, die unseren Interessen widersprechen, sollten gestürzt werden","Лидеры, противящиеся нашим интересам, должны быть свергнуты","Regestroj, kiu kontraŭas al niaj interesoj devas esti renversitaj","Liderzy, którzy sprzeciwiają się naszym interesom, powinni zostać obaleni",I leader internzionali che si oppongono ai nostri interessi dovrebbero essere spodestati,"Треба скидати лідерів, які перечать нашим інтересам"
3,0,3,1,International law should not bind my nation,Internationale Gesetze sollten nicht verpflichtend für mein Land sein,Международнее законодательство не должно ограничивать мою страну,Internaciaj leĝoj devas ne limigi mian nacion,Międzynarodowe prawo nie powinno być wiążące dla mojego kraju,La legge internationale non dovrebbe limitare la mia nazione,Міжнародне право не має обмежувати мою країну
3,0,2,1,"If a nation produces materials for us for a low price using cheap labor, we should still buy","Wenn ein Land für uns Waren billig mit günstigen Arbeitskräften herstellt, sollten wir weiterhin dort kaufen","Если страна производит для нас продукцию, используя для этого дешёвый труд, мы не должны отказываться от сделки","Se nacio produktas por ni ĉipajn materialojn, uzante ĉipan laborforcon, ni daŭre devas aĉeti ilin","Jeśli dane państwo produkuje dla nas materiały za niską cenę przy użyciu taniej siły roboczej, powinniśmy nadal je kupować","Anche se una nazione usa manodopera a basso costo per abbassare i costi di produzione, dovremmo comunque comprare i loro prodotti","Якщо держава виробляє для нас продукцію, використовуючи дешеву робочу силу, ми не повинні від неї відмовлятися"
3,0,2,1,My nation should only help other nations when it suits our interests,"Mein Land sollte anderen Ländern nur helfen, wenn es unseren Interessen entspricht","Мы должны помогать другим странам только тогда, когда это соответствует нашим интересам",Ni helpu aliajn naciojn nur se tio ne kontraŭas al niaj interesoj,"Mój naród powinien pomagać innym narodom tylko wtedy, gdy jest to zgodne z naszymi interesami",La mia nazione dovrebbe solo aiutare altre nazioni quando ne trae vantaggio,"Ми повинні допомагати іншим країнам тільки тоді, коли це вигідно для наших інтересів"
3,0,1,1,It is important for a government to maintain a strong military so that it can have global influence,"Es ist wichtig für einen Staat militärisch stark zu sein, um weltweiten Einfluss zu haben","Государство должно иметь и поддерживать сильную армию, чтобы иметь мировое влияние",Estas grave por registaro teni fortan militistaron por havi influon al la tutmondo,"Ważne jest, aby państwo było militarnie silne, aby mieć globalny wpływ",È importante che la mia nazione mantenga un esercito potente così da poter avere un influenza globale,"Держава має підтримувати сильну армію, щоби мати вплив на глобальну політику"
3,0,1,1,A nation without a military is a weak nation,"Eine Nation ohne Militär, ist eine schwache Nation",Нация без армии — это слабая нация,Nacio sen militistaro estas malforta nacio,Naród bez wojska jest słaby,Una nazione senza un esercito è una nazione debole,Нація без армії - це слабка нація
3,0,1,-1,Diplomatic options should always be tried before war is even considered,"Diplomatische Lösungen sollten immer bevorzugt werden, bevor überhaupt an Krieg gedacht wird",Дипломатические методы должны применяться всегда ещё даже до объявления войны, Diplomatiaj manieroj devas elproviĝi antaŭ oni eĉ supozos militon,"Opcje dyplomatyczne należy zawsze wypróbować, zanim wojnę się w ogóle uwzględni",Bisogna sempre tentare di risolvere crisi internazionali attraverso una via diplomatica prima di considerare di entrare in guerra,"Завжди варто обдумати дипломатичний варіянт вирішення конфлікту перед тим, як оголошувати війну"
3,0,2,-1,Overthrowing our enemies usually makes the situation worse than how it started,Unsere Feinde zu stürzen macht die Situation normalerweise schlimmer als sie begonnen hat,"Свержение вражеского строя обычно делает ситуацию лишь ещё хуже, чем до этого",Renverso de niaj malamikoj kutime faras la situation pli malbona ol en la komenco,"Obalenie naszych wrogów zwykle pogarsza sytuację, niż była",Rovesciare i governi dei nostri nemici di solito non fa altro che peggiorare la situazione,"Скидання уряду ворожої держави призводить до ще гіршої ситуації, ніж раніше"
3,0,3,-1,Military spending is a waste of money,Investitionen in das Militär sind Geldverschwendung,Военные расходы — это пустая трата денег,Militaj elspezoj estas perdo de mono,Wydatki na wojsko to strata pieniędzy,La spesa militare è uno spreco di soldi,Військові витрати - це непотрібне марнотратство
3,1,4,1,Any deals that another nation wants must be bad for us,"Jegliche Abkommen, die andere Nationen möchten, müssen schlecht für uns sein",Любые сделки с другими нациями по их инициативе идут нам лишь во вред,Ajanaj kontraktoj kun aliaj nacioj laŭ ilia volo ĉiam estas malbonaj por ni,"Wszelkie umowy, których chce inny naród, muszą być dla nas złe","Qualsiasi accordo voluto da un'altra nazione, non può che essere svantaggioso per la mia",Будь-яка угода з іншими націями за їхньою ініціативою є шкідливою для нас
3,1,4,1,Our nation would do better if it did not involve itself with other nations,"Unserem Land würde es besser gehen, wenn es sich nicht mit anderen Nationen verwickeln würde",Нашей нации было бы лучше не вступать ни в какие отношения с другими нациями,Estas pli bona por nia nacio ne interagi kun aliaj nacioj,"Lepiej byłoby naszemu krajowi, gdyby nie zaangażował się z innymi narodami",La nostra nazione starebbe meglio se non si facesse coinvolgere in ciò che fanno altre nazioni,Для нашої нації найкращим було би не вступати ні у які відносини з іншими націями
3,1,3,1,Our nation should never initiate a war,Unser Land sollte niemals einen Krieg beginnen,Наша нация никогда не должна объявлять кому-либо войну,Nia nacio neniam komencu militojn,Nasz naród nigdy nie powinien wywołać wojny,La nostra nazione non dovrebbe mai dare l'avvio ad un conflitto militare,Наша нація ніколи не має оголошувати іншим війну
3,1,3,1,We should make products in our own nation whenever possible,"Wir sollten Produkte in unserem eigenen Land, wann immer möglich, herstellen",Мы должны делать по возможности всю продукцию у себя в стране,Ni devas fari produktojn laŭeble nur en nia propra lando,W miarę możliwości powinniśmy wytwarzać produkty w naszym kraju,Dovremmo produrre più beni possibili all'interno della nostra nazione,"Ми зажди мусимо виробляти продукцію у своїй країні, якщо це можливо"
3,1,2,1,"It is a waste of our soldiers and resources to topple other governments, regardless of what they do","Es ist eine Verschwendung unserer Soldaten und Rohstoffe andere Regierungen zu stürzen, ganz gleich was sie tun","Свержение чужих режимов, что бы они не творили, — это пустая трата людей и ресурсов",Renverso de aliaj registaroj estas perdo de soldatoj kaj resursoj malgraŭ kion ili faras,"Marnotrawstwem naszych żołnierzy i zasobów jest obalenie innych rządów, bez względu na to, co robią","È uno spreco di vite umane e risorse cercare di rovesciare governi stranieri, indipendentemente dalle loro azioni","Скидання урядів інших держав це марна витрата солдатів та ресурсів, незалежно від того, що вони роблять"
3,1,2,1,"We must respect the sovereignty of other nations, even those who go against our principles","Wir müssen die Souveränität anderer Nationen respektiere, auch wenn sie gegen unsere Prinzipien sind","Мы должны уважать суверенитет других государств, даже тех, которые выступют против наших принципов","Ni respektu suverenon de ailaj landoj, eĉ tiuj, kiuj kontraŭas al niaj principoj","Musimy szanować suwerenność innych narodów, nawet tych, którzy łamią nasze zasady","Dobbiamo rispettare la sovranità delle altre nazioni, anche di quelle che vanno contro i nostri principi","Ми повинні поважати суверенітет інших народів, навіть тих, що виступають проти наших принципів"
3,1,1,1,My nation should focus primarily on domestic policy,Meine Nation sollte sich vorrangig auf Innenpolitik fokussieren,Моё правительство должно сконцентрироваться в первую очередь на внутренней политике,Mia nacio devas enfokusiĝi unue al la ena politiko,Mój naród powinien skoncentrować się przede wszystkim na polityce wewnętrznej,La mia nazione si dovrebbe concentrare principalmente sulla politica interna,Мій уряд має в першу чергу зосередитися на внутрішній політиці
3,1,1,1,Foreign policy has little influence on most people's daily lives,Außenpolitik hat wenig Einfluss auf den Alltag der meisten Leute,Внешняя политика мало влияет на повседневную жизнь большинства людей,Ekstera politiko havas malgrandan influon al ĉiutaga vivo de plejaj homoj,Polityka zagraniczna ma niewielki wpływ na codzienne życie większości ludzi,La politica estera ha poca influenza sulle vite ordinarie dei cittadini,Зовнішня політика має невеликий вплив на життя більшості населення
3,1,1,-1,It is important for our government to interact with its neighbours,Es ist wichtig für unsere Regierung mit unseren Nachbarn zu interagieren,Нашему правительству важно взаимодействовать с соседними странами,Estas grave por nia registaro interagi kun ĝiaj najbaroj,"Ważne jest, aby nasz rząd współdziałał z sąsiednimi państwami",È importante che il  governo interagisca con i paesi a noi vicini,Нашій нації необхідно взаємодіяти зі своїми сусідами
3,1,3,-1,I care that other nations respect my nation,"Ich sorge mich darum, dass andere Länder meines respektieren","Мне есть дело до того, уважают ли мою страну другие страны","Mi zorgas, ĉu aliaj nacioj respektas mian nacion","Dbam o to, aby inne narody szanowały mój naród",È importante per me che le altre nazioni rispettino la mia patria,Мені важлива повага інших народів до моєї нації
3,2,4,1,The world would be better off if countries diplomatically united into a single world government,"Die Welt wäre besser dran, wenn Länder sich diplomatisch in einem Weltstaat vereinigen","Мир был бы лучше, если бы все страны дипломатическим путём объединились в единое мировое правительство","La mondo estus multe pli bone, se ĉiuj landoj diplomatie unuiĝus en unueca tutmonda registaro","Świat byłby lepszy, gdyby kraje zjednoczyły się w jeden rząd światowy",Il mondo migliorerebbe se tutti i paesi si unissero diplomaticamente in un unico governo mondiale,"Світ був би краще, якби усі країни дипломатичним шляхом об'єдналися в єдиний світовий уряд"
3,2,4,1,"In order for humanity to survive, we must get past having separate nations","Um das Überleben der Menschheit zu gewährleisten, müssen wir es hinter uns lassen seperate Nationen zu haben","Чтобы выжить, человечество должно отказаться от деления на отдельные нации","Por vivi daŭre, la homaro devas ĉesi dividi sin en apartajn naciojn","Aby zapewnić przetrwanie ludzkości, musimy pozostawić odrębne narody","Perchè l'umanità sopravviva, bisogna superare il concetto di nazione","В ім'я виживання людства, нам необхідно відмовитися від поділу на окремі нації"
3,2,3,1,We are first and foremost citizens of Earth,Wir sind an erster Stelle Bürger der Erde,Мы в первую очередь граждане Земли,Ni estas la unuaj civitanoj de Tero,Jesteśmy przede wszystkim obywatelami Ziemi,Siamo prima di tutto cittadini del mondo,У першу чергу ми громадяни Землі
3,2,3,1,It is our duty to care for the citizens of other countries the same as we care for the citizens of our own,"Es ist unsere Pflicht, uns genauso um die Bewohner anderer Länder zu sorgen wie für die unseres Lands","Мы должны заботиться об иностранных гражданах так же, как и о своих собственных",Estas nia devo zorgi pri civitanoj de aliaj landoj same kiel pri civitanoj de nia propra lando,"Naszym obowiązkiem jest dbać o obywateli innych krajów tak samo, jak o naszych obywateli",È nostro dovere preoccuparci dei cittadini degli altri paesi tanto quanto ci preoccupiamo dei nostri connazionali,"Це наш обов'язок - піклуватися про громадян інших держав так само, як і про своїх"
3,2,3,1,The United Nations should be more powerful,Die Vereinten Nationen sollten mehr Macht haben,Необходимо расширить полномочия ООН,Unuigitaj Nacioj devas havi pli povojn,Organizacja Narodów Zjednoczonych powinna mieć większą siłę,L'ONU dovrebbe avere più poteri,Потрібно надати ООН більше повноважень
3,2,2,1,I support regional unions such as the European Union,Ich unterstütze regionale Zusammenschlüsse wie die Europäische Union,"Я поддерживаю региональные союзы, по типу Евросоюза","Ni subtenas regionajn uniojn, kiel Eŭropa Unio",Popieram unie regionalne takie jak Unia Europejska,Supporto organizzazioni sovranazionali come l'Unione Europea,"Я підтримую регіональні інтернаціональні організації, на зразок Європейського Союзу"
3,2,2,1,All governments should be held accountable to the international community for things such as war crimes,"Alle Regierungen sollten von der internationalen Gemeinschaft zur Verantwortung gezogen werden können, für Dinge wie Kriegsverbrechen","Правительства всего мира должны нести ответственность за такие проступки, как военные преступления","Ĉiuj registaroj devas havi responson antaŭ la tutmonda komunumo pro fiaĵoj, kiel militaj krimoj",Wszystkie rządy powinny ponosić odpowiedzialność przed społecznością międzynarodową za sprawy takie jak zbrodnie wojenne,Tutti i governi dovrebbero poter essere chiamti a rispondere davanti alla comunità internazionale per crimini di guerra e azioni simili,"Будь-які уряди мають відповідати перед міжнародною спільнотоюза такі речі, як військові злочини"
3,2,2,1,It is our duty to topple regimes that violate human rights,"Es ist unsere Pflicht Regierungsformen zu stürzen, die Menschenrechte verletzen","Мы должны свергнуть все режимы, которые ущемляют права человека","Ni renversu ĉiujn reĝimojn, kiuj rompas homajn regulojn","Naszym obowiązkiem jest obalenie reżimów, które naruszają prawa człowieka",È nostro dovere rovesciare governi che violano i diritti umani,"Скидати режими, які порушують права людини, це наш обов'язок"
3,2,1,1,International cooperation is generally beneficial,Internationale Bündnisse sind generell vorteilhaft,Международнее сотрудничество приносит много пользы,Internacia kunlaborado estas ĝenerale utila,Współpraca międzynarodowa jest na ogół korzystna,Generalmente la cooperazione internazionale porta benefici,Міжнародна співпраця в основному приносить користь
3,2,1,1,International alliances are important to protect my nation,"Internationale Bündnisse sind wichtig, um mein Land zu schützen",Международние альянсы важны для защиты моей нации,Internaciaj unioj estas gravaj por protekto de mia nacio,Międzynarodowe sojusze są ważne dla ochrony mojego narodu,Le alleanze internazionali sono importanti per proteggere la mia nazione,Міжнародні альянси важливі для захісту моєї нації
3,2,1,1,Nations should cooperate with each other unless there is a compelling reason not to,"Nationen sollten untereinander zusammenarbeiten, außer es gibt einen triftigen Grund es nicht zu tun","Страны всегда должны сотрудничать друг с другом, если только у них нет причины этого не делать","Nacioj devas ĉiam labori kune, se nur ne estas komprenebla kialo ne kunlabori","Narody powinny ze sobą współpracować, chyba że istnieją ważne powody, aby tego nie robić","Le nazioni dovrebbero cooperare tra di loro, a meno che ci sia una chiara ragione per non farlo","Країни завжди мусять співпрацювати один з одним, хіба у них є вагомі причини цього не робити"
3,2,2,-1,Foreign aid is a waste of money,Auslandshilfe ist Geldverschwendung,Помощь другим странам — это пустая трата денег,Helpo al eksteraj landoj estas perdo de mono,Pomoc zagraniczna to strata pieniędzy,Gli aiuti internazionali sono uno spreco di soldi,Допомога іншим країнам це марнотратство
3,2,2,-1,It is important to protect our national identity from other cultures,Es ist wichtig unsere nationale Identität vor anderen Kulturen zu schützen,Важно защитить индентичность моей нации от влияния других культур,Devas esti protekti la indentecon de mia nacio de aliaj kulturoj,"Ważne jest, aby chronić naszą tożsamość narodową przed wpływem innych kultur",Dobbiamo difendere la nostra identità nazionale dalle altre culture,Потрібно захищати нашу національну ідентичність від впливу інших культур
