Category,Subcategory,Strength,Multiplier,en,de,ru,eo,pl,it,ua
1,1,2,1,Whistleblowers who leak classified information that costs lives should be prosecuted,"Informanten, die geheime Menschenleben kostende Informationen veröffentlichen, sollten bestraft werden","Разоблачители секретной информции, от которой зависила жизнь людей, должны нести наказание","Homoj, kiuj malkaŝis sekretajn informojn koste de ies vivoj, devas puniĝi","Informatorzy, którzy publikują tajne informacje kosztujące ludzkie życie, powinni zostać ukarani","Se le informazioni riservate rivelate da una talpa finiscono per costare la vita a qualcuno, la talpa dovrebbe poter essere messa a processo","Викривачі секретної інформації, від якої залежать життя людей, повинні понести покарання"
1,1,2,1,We must sacrifice some freedoms to protect our country from terrorism,"Wir müssen einige unserer Freiheiten opfern, um unser Land vor Terrorismus zu schützen","Мы должны пожертвовать некоторыми свободами, чтобы защитить свою страну от терроризма",Ni oferu iujn liberojn por protekti nian landon de teroristoj,"Musimy poświęcić niektóre swobody, aby chronić nasz kraj przed terroryzmem",Dobbiamo privarci di alcune libertà per proteggere il nostro paese dal terrorismo,"Потрібно пожертвувати деякими свободами, щоби захистити країну від тероризму"
1,1,2,1,Government surveillance is necessary in the modern world,Staatliche Überwachung ist in der modernen Welt notwendig,В наши дни государственный надзор просто необходим,Registara observo estas necesa en la moderna mondo,Rządowa inwigilacja jest konieczna we współczesnym świecie,La sorveglianza ed il monitoraggio da parte dello stato sono necessari nel mondo moderno,Державний нагляд є необхідним у наші дні
1,1,1,1,It is important for national security that some materials are classified,"Es ist wichtig für die nationale Sicherheit, dass manche Materialien geheim sind","Для национальной безопасности важно, чтобы некоторая информация держалась под грифом «Секретно»",Estas grave por nacia sekureco resti iujn materialojn en sekreto,"Dla bezpieczeństwa narodowego ważne jest, aby niektóre materiały były tajne",È essenziale per la sicurezza nazionale che alcuni documenti ed informazioni rimangono top secret,"Для національної безпеки важливо, щоби деяка інформація залишалася таємною"
1,1,1,1,The government should have access to the emails of suspected terrorists,Die Regierung sollte Zugang zu den E-Briefen von vermeintlichen Terroristen haben,Правительство должно иметь доступ к перепискам всех подозреваемых в терроризме,La registaro devas havi atingon al retleteroj de suspektatoj je terorismo,Rząd powinien mieć dostęp do wiadomości e-mail podejrzanych o terroryzm,Il governo dovrebbe poter avere accesso alle email di sospetti terroristi,Уряд має мати доступ до листувань усіх підозрюваних у тероризмі
1,1,1,1,The government should be able to access the phones of convicted criminals to find additional criminals,"Die Regierung sollte Zugang zu den Mobiltelefonen von überführten Verbrechern haben, um weitere Verbrecher zu finden","Власти должны иметь доступ к телефонным разговором осуждённых преступников, чтобы предотвратить новые преступления",La registaro devas havi atingon al telefonoj de kondamnitaj krimuloj por preventi novajn krimojn,Rząd powinien mieć dostęp do telefonów skazanych przestępców w celu znalezienia dodatkowych przestępców,Il governo dovrebbe poter avere accesso ai telefoni dei criminali ormai processati per trovare altri criminali,"Влада має мати доступ до телефонних дзвінків засуджених злочинців, щоби знайти їх прибічників"
1,1,3,-1,"The government should never be able to prosecute someone for the truth, even if it is a matter of national security","Die Regierung sollte niemals jemanden für die Wahrheit bestrafen können sollen, auch wenn es eine Sache der nationalen Sicherheit ist","Государство никогда не должно быть вправе наказывать людей за правду, даже если на кону стоит национальная безопасность","La registaro ne rajtu puni iun pro la vero, eĉ se tio estas demando de nacia sekureco","Rząd nigdy nie powinien być w stanie ukarać nikogo za prawdę, nawet jeśli jest to kwestia bezpieczeństwa narodowego","Lo stato non dovrebbe avere il potere di processare qualcuno per aver svelato un segreto, anche in caso compromettesse la sicurezza nazionale","Держава не має права карати людину за правду, навіть якщо на кону стоїть національна безпека"
1,2,4,1,People who spread misinformation should be punished,"Menschen die Unwahrheiten verbreiten, sollten bestraft werden",Распростроняющие дезинформацию люди должны нести наказание,Oni devas puni misinformantojn,"Ludzie, którzy rozpowszechniają dezinformację, powinni zostać ukarani",Chi diffonde notizie false non dovrebbe essere punito,"Люди, які розповсюджують дезінформацію, мають бути покарані"
1,2,4,1,Speculations and facts which cannot be confirmed for certain should never be published,"Spekulationen und Fakten, die nicht eindeutig als richtig erwiesen werden können, sollten niemals veröffentlicht werden","Спекцляции и факты, которые не могут быть однозначно подтверждены, никогда не должны обнародываться",Spekulaĵoj kaj nekonfirmeblaj faktoj devas neniam publikiĝi,"Spekulacje i fakty, których nie można jednoznacznie udowodnić, że są poprawne, nigdy nie powinny być publikowane",Non bisognerebbe mai pubblicare speculazioni e fatti che non possono essere verificati,"Спекуляції та факти, що не можуть бути однозначно доказані, ніколи не мають публікуватися"
1,2,3,1,Social media platforms should be required to remove posts which promote conspiracy theories,"Soziale Netzwerke sollten verpflichtet sein Beiträge, die Verschwörungstheorien unterstützen, zu löschen","Необходимо обязать социальные сети удалять посты, продвигающие конспирологичекие теории","Oni devas postuli de sociaj mediatoj forigi afiŝojn, promovantaj konspriajn teoriojn",Od platform społecznościowych należy wymagać usuwania postów promujących teorie spiskowe,Bisognerebbe imporre ai social media di rimuovere i post che promuovono teorie del complotto,"Потрібно змусити соціальні мережі видаляти пости, які просувають конспірологічні теорії"
1,2,3,1,You should not have the right to make claims which are provably false,"Man sollte nicht das Recht haben Ansprüche zu stellen, die wahrscheinlich falsch sind",Никто не должен быть в праве делать заведомо ложные утверждения,Oni ne rajtu fari certe neverajn asertojn,"Nie powinno być prawa do wysuwania roszczeń, które mogą być fałszywe",Non dovresti avere il diritto di sostenere teorie che sono state provate false,"Ніхто не має мати права робити твердження, які завідома неправдиві"
1,2,2,1,The media should be penalized for reporting false headlines,Die Medien sollten bestraft dafür werden über falsche Schlagzeilen zu berichten,Необходимо ввести штрафы для СМИ за ложные заголовки,Oni devas puni mediatojn pro malveraj titoloj,Media powinny zostać ukarane za tworzenie niewłaściwych nagłówków,I media dovrebbero essere penalizzati per la pubblicazione di titoli non veritieri,Потрібно штрафувати ЗМІ за брехливі заголовки
1,2,2,1,Officials who intentionally deceive the population should be in prison,"Beamte, die beabsichtigt die Bevölkerung täuschen, sollten ins Gefängnis kommen","Чиновники, которые умышленно обманывают народ, должны сидеть в тюрьме","Oficistoj, kiuj intence trompas homojn, devas esti en malliberejo","Urzędnicy, którzy celowo oszukują ludność, powinni znajdować się w więzieniu",Funzionari che ingannano volontariamente la popolazione dovrebbero essere messi in prigione,"Політичні лиця, які навмисно обманюють населення, мають сидіти у в'язниці"
1,2,2,1,Social media should be responsible for fact checking advertisements that they host,"Soziale Netzwerke sollten dafür verantwortlich sein, die Werbungen, die sie schalten einer Faktenüberprüfung zu unterziehen","Социальные сети должны нести ответственность за правдивость рекламы, которая в них публикуется",Sociaj mediatoj devas responsi pri vereco de publikigata en ili reklamo,Media społecznościowe powinny być odpowiedzialne za sprawdzanie faktów w umieszczanych przez nich reklamach,I social media dovrebbero essere resi responsabili di controllare la veridicità dei post sulla loro piattaforma,"Соціальні мережі повинні нести відповідальність за достовірність та правдивість реклами, яка в них публікується"
1,2,1,1,The media should make more of an effort to report facts rather than opinions,Die Medien sollten sich mehr darum bemühen über Fakten anstatt Meinungen zu berichten,"СМИ должны больше стараться над тем, чтобы высказывать факты, чем мнения",Amaskomunikiloj devas pli multe peni raporti pri pli faktoj ol opinioj,"Media powinny zrobić więcej, aby zgłaszać fakty niż opinie",I media dovrebbero impegnarsi di più per riportare i fatti invece che le opinioni,"ЗМІ мають зосередитися на донесенні фіктів, а не поглядів"
1,2,1,1,The media should report facts even when the media disagrees with the implications of them,"Die Medien sollten über Fakten berichten, auch wenn diese ihren eigenen Schlussfolgerungen widersprechen","СМИ должно сообщать обо всех фактах, даже если они их не устраивают","Amaskomunikiloj devas raporti pri ĉiu faktoj,eĉ se ili ne konsentas kun kiel ĉio okazis","Media powinny zgłaszać fakty, nawet jeśli są one sprzeczne z ich własnymi wnioskami",I media dovrebbero riportare i fatti anche quando sono in disaccordo con le loro implicazioni,"ЗМІ мають публікувати усі факти, навіть якщо вони не згодні з ними"
1,2,2,-1,Truth is relative,Wahrheit ist relativ,Правда относительна,Vero estas rilativa,Prawda jest względna,La verità è relativa,Істина відносна
1,2,4,-1,"Facts are not real, there are multiple sides to everything","Fakten sind nicht echt, man kann alles aus verschiedenen Blickwinkeln sehen","Фактов не существует, у всего есть несколько сторон","Faktoj estas falsaj, ĉio havas multajn flankojn","Fakty nie są prawdziwe,wszystko widać pod różnymi kątami","Non esistono fatti oggettivi, ci sono solo diverse opinioni","Фактів як таких не існує, у всього є багато сторін"
1,0,1,-1,You should not have complete freedom of speech,Man sollte keine totale Meinungsfreiheit haben,Мы не должны иметь полную свободу слова,Ni ne havu plenan liberon de parolo,Nie powinno być całkowitej wolności słowa,La libertà di parola non dovrebbe essere assoluta,Нам не потрібна абсолютна свобода слова
2,0,4,1,Gay marriage should be illegal,Ehe unter Homosexuellen sollte illegal sein,Гей-браки должны быть вне закона,Samseksaj edzecoj devas ne esti leĝaj,Małżeństwa jednopłciowe powinny być nielegalne,I matrimoni omosessuali non dovrebbero essere permessi,Одностатеві шлюби мають бути заборонені
2,0,4,1,We should have a national religion,Wir sollten eine nationale Religion haben,У нас должна быть официальная религия,Ni havu naican religion,Powinniśmy mieć religię narodową,Dovremmo avere una religione di stato,Нам потрібна офіційна національна релігія
2,0,3,1,Premarital sex should be illegal,Vorehelicher Geschlechtsverkehr sollte illegal sein,Секс до свадьбы должен быть запрещён,Preedziĝa seksumo devas esti neleĝa,Seks przedmałżeński powinien być nielegalny,Il sesso prematrimoniale dovrebbe essere illegale,Секс до шлюбу має бути заборонений
2,0,3,1,Religious values should be taught in all schools,Religiöse Werte sollten in allen Schulen gelehrt werden,Религиозные ценности должны преподаваться во всех школах,Oni devas instrui religiajn valorojn en lernejoj,Wartości religijne powinny być nauczane we wszystkich szkołach,In tutte le scuole dovrebbero essere insegnati i valori religiosi,Релігійні цінності треба викладати у всіх школах
2,0,2,-1,People should be able to volunteer for experimental treatments when they have no treatment and will die if they do not,"Menschen sollten die Möglichkeit haben als Freiwillige bei experimentellen Behandlungen zu dienen, wenn sie keine Behandlung habe und sonst sterben würden","Люди должны иметь возможность добровольно тестировать на себе эксперментальные методы лечения в случае, если без них человек всё равно умрёт","Oni rajtu volontuli eksperimentan resanigon, se ne estas alia resanigo kaj sen ĝi oni mortos","Ludzie powinni mieć możliwość zgłaszania się na leczenie eksperymentalne, gdy nie mają szans na wyleczenie i umrą, jeśli tego nie spróbują",Ci si dovrebbe poter offrire volontario per trattamenti sperimentali quando non si ha ha accesso ad altri trattamenti e quella è l'unica chance di sopravvivere,"Треба дозволити людині добровільно тестувати експерементальні методи лікування, якщо без них вона і так помре"
2,0,2,1,It is important to maintain family values,Es ist wichtig familiäre Werte zu wahren,Поддерживать семейные ценности важно,Subteni familajn varolojn estas grave,Ważne jest zachowanie wartości rodzinnych,È importante mantenere intatti i valori familiari,Потрібно підтримувати сімейні цінності
2,0,2,1,We should have a national language and all immigrants should be required to speak it,"Wir sollten eine Amtssprache haben und alle Immigranten sollten verpflichtet sein, diese zu Sprechen ","У нас должен быть официальный язык, на котором должны уметь разговаривать все мигранты","Ni havu oficialan lingvon, kiun parolu ĉiuj migruloj",Powinniśmy mieć język narodowy i wszyscy imigranci powinni być zobowiązani mówienia w nim,"Dovremmo avere una lingua ufficiale, e tutti i migranti dovrebbero essere tenuti a parlarla",У нас має бути офіційна мова і усі мігранти мусять на ньому спілкуватися
2,0,2,1,The media is biased against traditional values,Die Medien sind gegenüber traditionellen Werten voreingenommen,СМИ ратуют против традционных ценностей,Amaskomunikiloj malsubtenas tradiciajn varolojn,Media są stronnicze w stosunku do tradycyjnych wartości,"I media non sono super partes, tendono ad opporsi ai valori tradizionali","ЗМІ упереджено ставиться до традиційних цінностей й налаштовано проти них"
2,0,2,1,There are only 2 genders,Es gibt nur zwei Geschlechter.,Есть только два гендера,Estas nur du genroj,Istnieją tylko 2 płcie,Esistono solo 2 generi,Є тільки дві статі
2,0,1,1,Murder and theft should be illegal,Mord und Diebstahl sollte illegal sein,Убийства и воровство должны быть вне закона,Murdoj kaj ŝteloj devas esti neleĝaj,Morderstwa i kradzieże powinny być nielegalne,L'omicidio e il furto dovrebbero essere illegali,Вбивство та крадіжка мають бути поза законом
2,0,4,-1,Abortion should always be legal,Abtreibung sollte immer legal sein,Аборты всегда должны быть легальны,Abortigoj devas ĉiam esti leĝaj,Aborcja zawsze powinna być legalna,L'aborto dovrebbe sempre essere legale,Аборти мають завжди бути дозволеними
2,0,2,-1,"It should be legal to alter your infant's DNA to make them stronger, smarter, etc.","Es sollte legal sein, die DNA von Kindern anzupassen, um sie stärker, schlauer, usw. zu machen","Необходимо разрешить изменять геном своих детей, чтобы делать их сильнее, умнее и т.д.","Leĝa devas esti ŝanĝado de genoj de viaj idoj por fari ilin pli fortaj, saĝaj, ktp.","Zmiana DNA dziecka powinna być legalna, aby było silniejsze, mądrzejsze itp.","Dovrebbe essere legale alterare il DNA del proprio figlio per renderlo più forte, intelligente, ecc.","Треба дозволити змінювати геном своїх дітей, з метою зробити їх сильніше, розумніше, т.п."
2,1,4,1,"If AI can govern better than humans can, then AI should rule","Wenn künstliche Intelligenz besser als Menschen regieren kann, sollte sie regieren","Если ИИ сможет управлять государством лучше, чем человек, тогда он и должен им управлять","Se AI povos regi pli bone ol homoj, do AI devos regi","Jeśli sztuczna inteligencja może rządzić lepiej niż ludzie, wtedy ona powinna rządzić","Se l'inteligenza artificiale può governare meglio degli umani, allora dovrebbe essere lei a governare","Якщо ШІ зможе керувати суспільствм краще, ніж це робить людина, то він і має цим займатися"
2,1,4,1,Cars should be banned to protect the environment,"Autos sollten verboten werden, um die Umwelt zu schützen","Необходимо запретить автомобили, чтобы защитить окружающую среду",Oni malpermesu aŭtojn por plibonigi la ekologion,Samochody powinny być zakazane w celu ochrony środowiska,Le auto dovrebbero essere messe al bando per proteggere l'ambiente,"Потрібно заборонити автомобілі, щоби захистити навколишнє середовище"
2,1,4,1,The government should require people to eat healthy,Die Regierung sollte Leute dazu verpflichten gesund zu essen,Государство должно требовать от людей здорово питаться,La registaro postulu homojn manĝi sane,Rząd powinien wymagać od ludzi zdrowego odżywiania się,Il governo dovrebbe richiedere ai cittadini di mangiare cibo salutare,Держава повинна вимагати від населення здорово харчуватися
2,1,3,1,Genetic modification research should be legal on humans,Genmodifikationsforschung an Menschen sollte legal sein,Необходимо разрешить исследования по генной модификации на людях,Genomodifadaj studoj sur homoj devas esti leĝaj,Badania nad modyfikacjami genetycznymi u ludzi powinny być legalne,Le modificazioni genetiche sugli umani dovrebbero essere permesse,Дослідження генетичних модифікацій на людях мають бути дозволені
2,1,3,1,Guns should be banned for the general population,Schusswaffen sollten für die Allgemeinbevölkerung verboten sein,Простым людям необходимо запретить пользоваться оружием,Ĝeneralaj homoj ne rajtu havi armilojn,Posiadanie broni powinno być nielegalne dla całej populacji,Le armi dovrebbero essere vietate al cittadino comune,Треба заборонити населенню володіти вогнепальною зброєю
2,1,3,1,There should be a limit to how many children a person may have to prevent overcrowding the Earth,"Es sollte eine Beschränkung für die Anzahl der Kinder einer Person geben, um Überbevölkerung zu verhindern","Необходимо установить лимит на количество детей в семье, чтобы избежать перенаселения Земли","Por preventi troan loĝatecon de Tero, devas esti lima kvanto de infanoj por ĉiu homo","Powinna istnieć granica liczby dzieci, aby zapobiec przeludnieniu",Ci dovrebbe essere un limite a quanti figli una persona può avere per prevenire la sovrappopolazione della Terra,"Потрібно установити ліміт на кількість дітей у сім'ї, щоби уникнути перенаселення Землі"
2,1,3,1,Private jets should be banned,Privatflugzeuge sollten verboten werden,Необходимо запретить личные самолёты,Privataj aeroplanoj devas esti malpermesitaj,Prywatne odrzutowce powinny zostać zakazane,I jet privati dovrebbero essere vietati,Треба заборонити приватні літаки
2,1,2,1,Plastic straws should be banned,Plastiktrinkröhrchen sollten verboten werden,Необходимо запретить пластиковые трубочки,Plastikaj ŝalmoj devas esti malpermesitaj,Słomki z tworzyw sztucznych powinny zostać zakazane,Le cannucce di plastica dovrebbero essere messe al bando,Потрібно заборонити пластикові соломинки
2,1,2,1,We should put effort into expanding civilization beyond earth,Wir sollten uns bemühen unsere Zivilisation außerhalb der Erde auszubreiten,Мы должны прикладывать усилия к распространению нашей цивилизации за пределы Земли,Ni penu etedi la civilon eksteren de Tero,Powinniśmy starać się rozszerzać cywilizację poza Ziemię,Dovremmo collettivamente impegnarci per espandere la nostra civilizzazione oltre la Terra,"Нам треба докладати зусиль, щоби розповсюдити нашу цивілізацію за межі Землі"
2,1,1,1,Climate change is a real threat,Klimawandel ist eine wirkliche Gefahr,Изменение климата — это реальная угроза, Klimataj ŝanĝoj estas vera minaco,Zmiany klimatyczne są prawdziwym zagrożeniem,Il cambiamento climatico è un serio problema,Зміна клімату - реальна загроза
2,1,1,1,Technological progress is always good,Technologischer Fortschritt ist immer gut,Технический погресс — это всегда хорошо,Teknologia progreso ĉiam estas bona,Postęp technologiczny jest zawsze dobry,Il progresso tecnologico è sempre positivo,Технологічний прогрес - це завжди на краще
2,1,1,1,Automation has the potential to give significant benefits to humanity,Automatisierung hat das Potenzial der Menschheit signifikante Vorteile zu erbringen,У автомативации есть шанс принести значительную пользу человечеству,Aŭtomatigo povas doni signifan ution al la homaro,Automatyzacja może przynieść ludzkości znaczne korzyści,L'umanità ha il potenziale di trarre grandi benefici dall'automazione,Автоматизація має шанс принести значну користь людству
2,1,1,1,Evolution should be taught in schools,Die Evolutionstheorie sollte in Schulen gelehrt werden,Теорию эволюции необходимо преподавать в школах,Oni devas instrui la evolucian teorion en lernejoj,Teorii ewolucji należy uczyć w szkołach,La teoria dell'evoluzione dovrebbe essere insegnata nelle scuole,Еволюційне вчення повинно викладатися у школах
