Category,Subcategory,Strength,Multiplier,en,de,ru,eo,pl,it,ua
0,0,4,1,Most or all of the economy should be nationalized,Die Wirtschaft sollte zum großen Teil oder komplett verstaatlicht werden,Вся или большая часть экономики должна быть национализирована,Tuta aŭ preskaŭ tuta ekonomio devas esti naciigita,Większość lub całość gospodarki powinna być znacjonalizowana,L'interezza o buona parte dell'economia dovrebbe essere nazionalizzata,Уся чи більшість економіки має бути націоналізована
0,0,4,1,Capitalism should fundamentally be replaced,Kapitalismus sollte grundlegend ersetzt werden,Капитализм должен быть полностью замещён другим строем,Kapitalismo devas esti fundamente anstataŭita,Kapitalizm powinien zostać zasadniczo zastąpiony,Il capitalismo dovrebbe essere sostituito,Капіталізм має бути повністю замінений іншою формою суспільства
0,0,3,1,There should be a national healthcare service,Es sollte ein staatliches Gesundheitswesen geben,Должна существовать государственная система здравохранения,Devas esti nacia resaniga servo,Powinna istnieć państwowa służba zdrowia,Ci dovrebbe essere un sistema sanitario pubblico,Повинна існувати державна система медичного обслуговування
0,0,2,-1,Government owned industry is usually a bad idea,Staatseigene Industrie ist für gewöhnlich eine schlechte Idee,Государственные предприятия — это обычно плохая идея,"Industrio, posedata de la registaro, kutime estas malbona ideo",Przemysł będący własnością państwa jest zwykle złym pomysłem,Generalmente è una cattiva idea avere parti del settore industriale sotto controllo statale,Державне підприємство - це зазвичай погана ідея
0,0,2,1,The government should run the healthcare insurance industry,Der Staat sollte das Krankenversicherungsgewerbe leiten,Системой медицинского страхования должно заведовать государство,La registaro devas mastri asekuradon de sano,Rząd powinien zarządzać branżą ubezpieczeń zdrowotnych,É lo stato che dovrebbe gestire le assicurazioni sanitarie,Медичним страхуванням має піклуватися держава
0,0,2,1,Public utilities like roads and electricity should all be publicly owned,Öffentliche Versorgungsunternehmen wie Straßen und Strom sollten alle volkseigen sein,"Общественные объекты, типа дорог и электростанций, должны быть в общественной собствености","Publikaj utilaĵoj, kiel vojoj kaj elektrejoj, devas esti sub publika posedo","Obiekty użyteczności publicznej, takie jak drogi i prąd, powinny być własnością publiczną","Tutti i beni di pubblica utilità, come le strade e l'elettricità, dovrebbero essere di proprietà dello stato","Загальноважливі об'єкти, такі як дороги та електростанції, мають бути державною(суспільною) власністю"
0,0,1,1,Capitalism has problems,Kapitalismus hat Probleme ,У капитализма есть проблемы,Kapitalismo havas problemojn,Kapitalizm ma problemy, Il capitalismo ha dei problemi,Капіталізм має недоліки
0,0,1,1,Some industries such as the postal service should be government-run,"Manche Gewerbe, wie das Postgewerbe, sollten staatsgeführt sein","Некоторыми предприятиями, типа почтовых служб, должно заведовать государство","Iuj industrioj, kiel poŝtaj servoj, devas mastriĝi de la registaro","Niektóre branże, takie jak usługi pocztowe, powinny być zarządzane przez rząd","Alcune attività, come le poste, dovrebbero essere di proprietà statale","Деякими підприємствами, на зразок поштових служб, має керувати держава"
0,1,1,-1,Regulation cannot fix all problems in the economy,Regulierung kann nicht alle wirtschaftlichen Probleme lösen,Регуляция экономики не решит всех её проблем,Regulado ne kapablos solvi ĉiujn problemojn de ekonomio,Regulacja nie może rozwiązać wszystkich problemów w gospodarce,La regolamentazione dell'economia non può risolverne tutti i problemi,Регуляції не можуть вирішити усіх проблем економіки
0,1,4,1,Strictly regulated capitalism is the ideal economy,Strikt regulierter Kapitalismus ist die ideale Wirtschaftsform,Строго регулируемый капитализм — это идеальная идеология,Strikte regulata kapitalismo estas ideala ideologio,Ściśle regulowany kapitalizm jest idealną gospodarką,Un capitalismo fortemente regolamentato è il sistema economico ideale,Строго регульований капіталізм - це ідеальна ідеологія
0,1,3,1,"For any economic problem, there is a regulation that can fix it","Für jedes wirtschaftliche Problem gibt es eine Regulierung, die es lösen kann","Не существует экономической проблемы, которую невозможно решить регуляцией","Por ajna ekonomia problemo, estas reguligo, kiu povos solvi ĝin","W przypadku każdego problemu ekonomicznego istnieje przepis, który może to naprawić","Per ogni problema economico, esiste una regolamentazione che lo può risolvere","На кожну економічну проблему є регуляція, яка її вирішить"
0,1,3,1,Companies that sneakily break regulations and are caught should be disbanded,"Firmen, die heimlich Regeln brechen und dabei erwischt werden, sollten aufgelöst werden","Организации, пойманные на хитрых обходах регуляционных мер, должны быть ликвидированы","Kompanioj, kiuj kaptiĝas je ruzaj rompoj de reguligoj, devas esti disigitaj","Firmy, które podstępnie łamią przepisy i zostają złapane, powinny zostać rozwiązane",Le aziende che vengono sorprese a violare delle norme dovrebbero essere smantellate,"Фірми, які обходять заборони й обмеження, мають бути ліквідовані"
0,1,2,1,The government must regulate the economy to protect the environment,"Der Staat muss die Wirtschaft regulieren, um die Umwelt zu schützen","Государство должно регулировать экономику, чтобы сохранить окружающую среду",La registaro devas reguli la ekonomion por protekti la ekologion,"Rząd musi regulować gospodarkę, aby chronić środowisko",Lo stato deve regolamentare l'economia per proteggere l'ambiente,"Держава повинна регулювати економіку, щоби зберегти навколишнє середовище"
0,1,2,1,The government is needed to break up monopolies and ensure there is fair competition,Der Staat muss Monopole auflösen und einen gerechten Wettkampf sichern,Госдуарство необходимо для ликвидации монополий и гарантии честной конкуренции,La registaro estas bezonata por rompado de monopolioj kaj garantio de honora konkurado,Rząd jest potrzebny do zerwania monopoli i zapewnienia uczciwej konkurencji,C'è bisogno del governo per smantellare i monopoli ed assicurarsi che il mercato rimanga competitivo,Держава потрібна для ліквідації монополій та забезпечення чесної конкуренції
0,1,3,-1,Government regulations rarely completely solve the problem they intended to fix,"Staatliche Regulierungen lösen selten wirklich das Problem, das sie beseitigen wollten","Государственное регулирование редко когда полностью решает проблемы, с которыми оно должно бороться","Registaraj reguligoj rare plene solvas la problemon, kiun ili intencas solvi","Przepisy rządowe rzadko całkowicie rozwiązują problemy, które chciały rozwiązać",Le regolamentazioni imposte dal governo raramente sono risolvono i problemi per i quali sono state imposte,"Державна регуляція рідко вирішує проблеми, з якими вона мусить боротися"
0,1,1,1,The economy should consist of private companies with some regulations to ensure fair competition,"Die Wirtschaft sollte aus privaten Unternehmen mit einigen Regulierungen bestehen, um gerechten Wettkampf zu sichern","Экономику должны вести частные компании, которые ограничены лишь некоторыми регуляциями, необходимыми для поддержания честной конкуренции",La ekonomio konsistu el privataj kompanioj kun iom da reguligoj por honora konkurado,"Gospodarka powinna składać się z prywatnych firm z pewnymi przepisami, aby zapewnić uczciwą konkurencję","L'economia dovrebbe consistere di aziende private regolamentate, così da garantire competizione leale tra di esse","Економіка повинна складатися з приватних компаній та підприємств, обмежених лише певними регуляціями з метою підтримки чесної конкуренції"
0,1,1,1,Consumer protection laws to ensure products are safe are important,"Verbraucherschutzgesetze, die dafür sorgen, dass Produkte sicher sind, sind wichtig","Законы по защите прав потребителей, гарантирующие бесопасность товаров, важны.","Konsumantprotektaj leĝoj, kiuj garantias sendanĝerecon de produktoj, estas gravaj",Ważne są przepisy dotyczące ochrony konsumentów zapewniające bezpieczeństwo produktów,"Le leggi a tutela del consumatore, che si assicurano che un prodotto sia sicuro, sono importanti","Закони по захисту прав споживачів, які регулюють якість товару, є важливими"
0,2,4,1,The government should not regulate the economy at all,Der Staat sollte die Wirtschaft gar nicht regulieren.,Государство вообще не должно регулировать экономику,La registaro devas entute ne reguli la ekonomion,Rząd w ogóle nie powinien regulować gospodarki,Lo stato non dovrebbe imporre regolamentazioni sull'economia,Держава взагалі не повинна регулювати економіку
0,2,4,1,Everything that can be left to the free market should be,"Alles, was dem freien Markt überlassen werden kann, sollte es auch","Всё, чем может управлять свободный рынок, должно принадлежать ему",Ĉio lasebla por libera merkato devas esti lasita por ĝi,"Wszystko, co można pozostawić wolnemu rynkowi, powinno być", Dovremmo lasciare di competenza al libero mercato tutto ciò che possiamo,"Усе, що може управлятися законами вільного ринку, має належати йому"
0,2,3,1,The government should never break up a company,Der Staat sollte niemals ein Unternehmen schließen,Госдуарство никогда не должно проводить ликвидацию компаний,La registaro ne rajtu disigi kompaniojn,Rząd nigdy nie powinien rozkładać firmy,Lo stato non dovrebbe mai smantellare o dividere un'azienda privata,Держава ніколи не маємати права ліквідовувати компанії
0,2,3,1,Government intervention in the economy almost always makes the economy worse,Staatliche Eingriffe in der Wirtschaft macht es fast immer schlimmer,Вмешательство государства в экономику почти всегда ослабляет её,Ekonomia interveno de la registaro preskaŭ ĉiam plimalbonigas la ekonomion,Interwencja rządowa w gospodarce prawie zawsze pogarsza sytuację gospodarczą,Gli interventi del governo nell'economia non possono che peggiorare la situazione,Втручання держави в економіку майже завжди тільки шкодить їй
0,2,3,1,The market will always make the best product unless the government intervenes,"Der Markt wird immer die besten Produkte machen, außer der Staat greift ein","Рынок всегда будет производить лучшую продукцию, если в его дела не будет вмешиваться государство","La merkado ĉiam faros la plej bonajn produktojn, nur se la registaro ne intervenos","Rynek zawsze będzie najlepszym produktem, chyba że rząd zainterweniuje","Il mercato crea sempre i prodotti migliori, a meno che lo stato intervenga","Вільний ринок завжди вироблятиме найкращий товар, якщо держава не буде у нього втручатися"
0,2,2,1,Excessive government intervention hurts the economy,Übermäßiges Einschreiten des Staates schadet der Wirtschaft,Чрезмерное вмешательство государства всегда наносит ущерб экономике,Ekscesa interveno de la registaro damaĝas la ekonomion ,Nadmierna interwencja rządu szkodzi gospodarce,L'eccessivo interventismo economico fa male all'economia,"Занадто велике втручання держави в економіку шкодить їй"
0,2,3,-1,Oppression by corporations is a much more real threat than oppression by the government,"Unterdrückung durch Unternehmen ist eine größere wirkliche Gefahr, als Unterdrückung durch die Regierung","Гнёт со стороны корпораций — куда более реальная угроза, чем гнёт со стороны государства",Opreso fare de korponacioj estas multe pli ebla minaco ol opreso fare de la registaro,Ucisk ze strony korporacji jest znacznie bardziej realnym zagrożeniem niż ucisk ze strony rządu,L'oppressione da parte di grandi multinazionali è un pericolo più reale che l'oppressione da parte dello stato,"Утиск зі сторони корпорацій - набагато більш реальна загроза, ніж утиск зі сторони держави"
0,2,1,1,Competition generally makes the economy better,Wettkampf generell macht die Wirtschaft besser,Конкуренция обычно укрепляет экономику,Konkurado ĝenerale plibonigas la ekonomion,Konkurencja ogólnie poprawia gospodarkę,"La competizione, in generale, migliora l'economia",Конкуренція в цілому зміцнює економіку
0,2,1,1,Capitalism is better than any existing alternative,Kapitalismus ist besser als jede existierende Alternative,Капитализм превосходит любые существующие ему альтернативы,Kapitalismo estas pli bona ol ajna ekzistanta alternativo,Kapitalizm jest lepszy niż jakakolwiek istniejąca alternatywa,Il capitalismo è la migliore tra le alternative che abbiamo,Капіталізм краще за будь-які наразі існуючі альтернативи
1,0,4,1,It should be legal to scream fire in a crowded building when there's no fire,"Es sollte erlaubt sein in einem vollem Gebäude Feuer zu schreien, obwohl dort keins ist","Нельзя законодательно запрещать кричать «Пожар!» в здании с кучей людей, когда никакого пожара нет","Devas esti neleĝe krei pri incendio en ejo, plena de homoj, kie estas neniu incendio","Krzyczenie „ogień” w zatłoczonym budynku powinno być legalne, gdy nie ma ognia",Dovrebbe essere legale urlare «Al fuoco!» in un edificio affollato anche se non c'è nessun incendio,"Не можна законодавчо забороняти кричати "Пожежа!" у будинку з великою кількістю людей, коли пожежі немає"
1,0,4,1,There should be no police force,Es sollte keinen Polizeiapparat geben,Полиции не должно существовать,Policaj forcoj devas ne esti,Nie powinno być policji,La polizia non dovrebbe esistere,Поліції не має існувати
1,0,3,1,There should be no legal repercussions for using extremely offensive language,Es sollte keine rechtlichen Folgen haben extrem beleidigende Sprache zu verwenden,Крепкие ругательства и мат не должны преследоваться по закону,Uzado de ekstreme ofendigaj vortoj devas ne havi leĝajn sekvojn,Używanie wyjątkowo obraźliwego języka nie powinno mieć prawnych konsekwencji,Non ci dovrebbero essere ripercussioni legali per l'uso di linguaggio estremamente volgare o offensivo,Ненормативна та аґресивна лексика не має заборонятися законом
1,0,3,1,There should be no legal repercussions for supporting any ideology,Es sollte keine rechtlichen Folgen haben eine Ideologie zu unterstützen,Поддержка любой идеологии не должна преследоваться по закону,Subtenado de ajna ideologio devas ne havi leĝajn sekvojn,Nie powinno być żadnych skutków prawnych dla wspierania jakiejkolwiek ideologii,Non ci dovrebbero essere ripercussioni legali per il supporto ad una certa ideologia politica,Слідування будь-якій ідеології не має переслідуватися законом
1,0,2,1,Cracking down on speech usually makes what you were trying to censor spread more,"Hart gegen Meinungen vorzugehen lässt für gewöhnlich, das was man versucht zu zensieren, schneller verbreiten","Суровое претеснение взглядов обычно лишь способствует распространению того, что пытаются подвергунть цензуре","Forta subpremo de opinioj kutime popularigas tion, kion oni provas cenzuri","Utrudnianie w wyrażaniu opinii zwykle oznacza, że ​​to, co próbujesz cenzurować, rozprzestrzenia się szybciej",La censura non fa altro che contribuire alla diffusione di ciò che si voleva condannare,"Жорстке придушення певної ідеї лише пробуджує інтерес до неї та стимулює росповсюдження того, що намагаються зацензурити"
1,0,2,1,Freedom of speech is an important concept,Meinungsfreiheit ist ein wichtiges Konzept,Свобода слова — это важная концепция,Libero de parolo estas grava koncepto,Wolność słowa to ważna koncepcja,La libertà di parola è un un valore importante,Свобода слова - це важлива концепція для суспільства
1,0,2,1,Protesting is a way of showing patriotism,Protestieren ist ein Weg Patriotismus zu zeigen,Протесты — это способ показать любовь к своей Родине,Protestoj estas maniero montri patriotismon,Protestowanie jest sposobem pokazania patriotyzmu,La protesta è una forma di patriottismo,Протест - це прояв патріотизму
1,0,2,1,Police should be regulated more,Die Polizei sollte mehr reguliert werden,Деятельность полиции должна регулироваться жёстче,Oni devas reguli policon pli multe,Policja powinna podlegać większej regulacji,La polizia dovrebbe essere più controllata,Діяльність поліції повинна бути під жорсткішим наглядом
1,0,2,1,Whistleblowers should be strongly protected,Informanten sollten stark beschützt werden,Разоблачителей тайн необходимо сильно защищать,Oni devas protekti malkaŝantojn pli forte,Informatorzy powinni być silnie chronieni,Gli informatori dovrebbero essere messi sotto protezione,Викривачів таємниць потрібно сильно захищати
1,0,1,1,I support the right for people I disagree with to voice their opinions,"Ich unterstütze das Recht von Leuten, denen ich nicht zustimme, ihre Meinung zu teilen","Я не против того, чтобы те, с кем я не согласен, тоже имели право выражать своё мнение","Mi subtenas rajton esprimi sian opinion de homoj, kun kiuj mi malkonsentas","Popieram prawo osób, z którymi się nie zgadzam, do wyrażania swoich opinii",Io supporto il diritto di parola anche di chi non la pensa come me,"Я не проти того, щоби ті, з ким я не згоден, також могли вільно висловлювати свою думку"
1,0,1,1,The government has no business looking into most people's personal lives,Es ist nicht die Sache des Staats das persönliche Leben von den meisten Leuten zu beobachten,Правительство не должно сувать свой нос в личную жизнь большинства граждан,La registaro ne havas kaŭzon por observi personan vivon de plejaj homoj,Rząd nie ma biznesu w zajmowaniu się życiem osobistym większości ludzi,Lo stato non ha ragione di interessarsi alle vite private dei cittadini,Держава не має права сувати свій ніс в особисте життя більшості своїх громадян
1,0,1,1,The government should not prosecute people for expressing an opinion,Der Staat sollte keine Leute dafür bestrafen eine Meinung kundzutun,Государство не должно преследовать людей за выражение своего мнения,La registaro devas ne puni homojn pro esprimado de ilia opinio,Rząd nie powinien ścigać ludzi za wyrażanie opinii,Lo stato non dovrebbe processare i suoi cittadini per aver espresso un'opinione,Держава не має переслідувати людей за вираження своєї думки
1,1,4,1,Those who disagree with the government should be removed from the country,"Die, die mit der Regierung nicht übereinstimmen, sollten aus dem Land entfernt werden","Необходимо выселять из страны тех, кто не согласен с её властями","Homoj, kiuj malkonsentas kun la registaro, devas esti forigitaj de la lando","Ci, którzy nie zgadzają się z rządem, powinni zostać usunięci z kraju",Chi è in disaccordo con lo stato dovrebbe essere rimosso dal territorio nazionale,"Необхідно виселити з країни людей, які незгодні з її урядом"
1,1,4,1,Protesting the government should be illegal,Gegen den Staat zu protestieren sollte illegal sein,Необходимо запретить протесты против власти,Protestoj kontraŭ la registaro devas esti neleĝaj,Protestowanie przeciwko rządowi powinno być nielegalne,Protestare contro il governo dovrebbe essere illegale,"Потрібно заборонити протестувати проти влади"
1,1,3,1,The government should monitor all citizens to combat terrorism,"Die Regierung sollte alle Bürger beobachten, um Terrorismus zu bekämpfen",Государство должно следить за всеми гражданами для борьбы с терроризмом,La registaro devas monitori ĉiujn civitanojn por venki terorismon,Rząd powinien monitorować wszystkich obywateli w celu zwalczania terroryzmu,Il governo dovrebbe monitorare tutti cittadini per prevenire atti terroristici,"Уряд мусить слідкувати за усіма громадянами для боротьби з тероризмом"
1,1,3,1,Police need more power and protection,Die Polizei braucht mehr Macht und Schutz,Полиция должна иметь больше защиты и мощи,Polico devas havi pli da protekto kaj povoj,Policja potrzebuje więcej mocy i ochrony,La polizia ha bisogno di più potere e protezione,Поліції потрібно більше влади й захисту
1,1,3,1,"If you have nothing to hide, you should have nothing to fear from the government monitoring your communications","Wenn man nichts zu verbergen hat, sollte man keine Angst davor haben, dass die Regierung die Kommunikation überwacht","У тебя нет причин бояться прослушки со стороны властей, если тебе нечего скрывать","Se vi ne volas kaŝi ion, vi ne havas kaŭzon por timi komunikobservon de la registaro","Jeśli nie masz nic do ukrycia, nie powinieneś się obawiać, że rząd monitoruje twoje aktywności","Se non hai niente da nascondere, non hai ragione di avere paura nel momento in cui lo stato monitora le tue comunicazioni","Немає причин боятися нагляду чи прослуховування зі сторони держави, якщо тобі немає чого ховати"
